{
  "revision_id": "323e4567-e89b-12d3-a456-426614174022",
  "agent_id": "123e4567-e89b-12d3-a456-426614174001",
  "revision_type": "IDENTITY",
  "target_profile_id": "123e4567-e89b-12d3-a456-426614174000",
  "parent_revision_digest": "sha256:5555555555555555555555555555555555555555555555555555555555555555",
  "content_digest": "sha256:6666666666666666666666666666666666666666666666666666666666666666",
  "state": "ACTIVE",
  "proposed_by": "123e4567-e89b-12d3-a456-426614174002",
  "authorized_by": "123e4567-e89b-12d3-a456-426614174002",
  "approval_grant_id": "423e4567-e89b-12d3-a456-426614174030",
  "created_at": "2026-03-30T05:00:00Z",
  "updated_at": "2026-03-30T05:00:00Z"
}
