{
  "revision_id": "323e4567-e89b-12d3-a456-426614174021",
  "agent_id": "123e4567-e89b-12d3-a456-426614174001",
  "revision_type": "SOUL",
  "target_profile_id": "223e4567-e89b-12d3-a456-426614174011",
  "parent_revision_digest": "sha256:3333333333333333333333333333333333333333333333333333333333333333",
  "content_digest": "sha256:4444444444444444444444444444444444444444444444444444444444444444",
  "state": "ACTIVE",
  "proposed_by": "123e4567-e89b-12d3-a456-426614174001",
  "authorized_by": "123e4567-e89b-12d3-a456-426614174001",
  "approval_grant_id": null,
  "created_at": "2026-03-30T04:00:00Z",
  "updated_at": "2026-03-30T04:00:00Z"
}
